{
  "schemaVersion": 1,
  "acquisitionId": "20260819t205026z__gbif-download__a56cc00163f2",
  "acquisitionReceiptPath": "src/data/research/national-acquisitions/20260819t205026z__gbif-download__a56cc00163f2/receipt.json",
  "acquisitionReceiptSha256": "2b3103801ff62bcff5c8e2b471d2a22d6f3eb475e8cc28a97ce3734c5477ada4",
  "partitionReceiptPath": "ops/national-research/evaluations/gbif-national-partition-160770d480911a82.json",
  "partitionReceiptSha256": "5751bb7a8a8f01e3bee407a331b4e26f7d5f84488c6d69ea9a24c3c04cd84696",
  "downloadKey": "0025310-260806074905277",
  "doi": "10.15468/dl.suxd7u",
  "license": "http://creativecommons.org/licenses/by-nc/4.0/legalcode",
  "archive": {
    "path": "src/data/research/national-acquisitions/20260819t205026z__gbif-download__a56cc00163f2/download.zip",
    "sha256": "d14b1415eddcd698135635a275ea2b55fa7657bc11c28fdf97c77f999087388c",
    "bytes": 334345,
    "providerTotalRecords": 381
  },
  "sourceId": "gbif-preserved-specimens",
  "stateCode": "HI",
  "selectionId": "round-77-gbif-national-selection-20260819-r1",
  "selectionPairCount": 40,
  "selectionPairSha256": "43b93e0e130cd54e9010b18aae31b7e4ac1d3376d246a9256aa94886b062a6a5",
  "adapterVersion": "1.4.0",
  "adapterCodeSha256": "7d076ab671d917fbcacc4c051f25266153f11d2b6cb80280b06dd1e7aec2e2a5",
  "replayCodeSha256": "f46eaf54287e0f1e37f514ff317de9955882fb2dd01704495361f60a150a04b1",
  "partitionRunnerSha256": "725676a1515b0501ec81ee91d5532beeef7b03f774fabb8a36b2ad2614200b38",
  "partitionMode": "provider-native-national-dwca-exact-state-county-text-no-coordinate-assignment",
  "archiveInspection": {
    "entries": [
      "citations.txt",
      "dataset/0039bbb4-f753-40fd-8629-a4ed74fc5c6b.xml",
      "dataset/032f8d2d-d08b-4d29-a58f-b0eef3e83075.xml",
      "dataset/07a54454-87c7-4e1e-b2ba-88a9d98d534b.xml",
      "dataset/07afc988-ad0b-4664-890e-96ac643ffbc7.xml",
      "dataset/07fd0d79-4883-435f-bba1-58fef110cd13.xml",
      "dataset/08dc18e5-e3c0-4f74-b49a-b8274aabe020.xml",
      "dataset/13dacd48-5790-4b99-bf04-08b23922e8aa.xml",
      "dataset/15f819bd-6612-4447-854b-14d12ee1022d.xml",
      "dataset/1804436b-6a12-4fcc-a372-531cc23a41c4.xml",
      "dataset/197908d0-5565-11d8-b290-b8a03c50a862.xml",
      "dataset/1aaec653-c71c-4695-9b6e-0e26214dd817.xml",
      "dataset/1b9eaa10-8441-481c-b50a-391ba168a86f.xml",
      "dataset/1cbed1d0-f9ac-4b9e-bf3f-a26272bca39e.xml",
      "dataset/27b4ff4b-29c3-4017-9c48-3750861392f7.xml",
      "dataset/2a79f202-3f3a-4d54-88fa-09aa8de1ac73.xml",
      "dataset/31fd4785-7ed4-422f-91fa-03b3833937a0.xml",
      "dataset/3633e0e7-8c25-4c3d-b9c7-078c0be25665.xml",
      "dataset/39c43f87-ad33-48f6-867c-29768e1f06d1.xml",
      "dataset/3dedd874-1c74-487c-9fb3-48dcaf922bab.xml",
      "dataset/415cdd20-b2a4-45b1-8918-b6a4bf188ffe.xml",
      "dataset/44525bc9-4412-441a-9890-1df3d289e3f6.xml",
      "dataset/4c122e6f-b2a4-4f91-aff5-449e9afb57b3.xml",
      "dataset/5288946d-5fcf-4b53-8fd3-74f4cc6b53fc.xml",
      "dataset/56e9c560-bd2a-11dd-b15e-b8a03c50a862.xml",
      "dataset/5d6c10bd-ea31-4363-8b79-58c96d859f5b.xml",
      "dataset/5d7f5915-0561-4107-aa20-20a4267c203f.xml",
      "dataset/648e3756-5dff-462b-9323-41e3214d9c3c.xml",
      "dataset/689d12fc-aac8-4203-bace-4e64d3d61b89.xml",
      "dataset/6ff42543-528d-4249-99bd-350bdd21b424.xml",
      "dataset/70e448fa-98b0-4ae7-a7a4-404f6175e7c9.xml",
      "dataset/780977d6-1cdb-4804-904f-9303cce8b4a1.xml",
      "dataset/7827f68d-c981-4023-bace-288a03434044.xml",
      "dataset/7a25f7aa-03fb-4322-aaeb-66719e1a9527.xml",
      "dataset/7bd65a7a-f762-11e1-a439-00145eb45e9a.xml",
      "dataset/7c93d290-6c8b-11de-8226-b8a03c50a862.xml",
      "dataset/7e380070-f762-11e1-a439-00145eb45e9a.xml",
      "dataset/7fc39a52-0d5c-40e1-a6a7-c64068a1fa76.xml",
      "dataset/813b435e-f762-11e1-a439-00145eb45e9a.xml",
      "dataset/821cc27a-e3bb-4bc5-ac34-89ada245069d.xml",
      "dataset/83ae84cf-88e4-4b5c-80b2-271a15a3e0fc.xml",
      "dataset/861e6afe-f762-11e1-a439-00145eb45e9a.xml",
      "dataset/89c53edb-0fac-4118-bdc0-d70ca50953dc.xml",
      "dataset/8a58ec9c-d510-4ffc-8774-95aed106c323.xml",
      "dataset/8bd8c361-c96b-40c9-91a0-eb3c0e7e0135.xml",
      "dataset/96b54e8c-f762-11e1-a439-00145eb45e9a.xml",
      "dataset/9781ce05-2379-4a10-ab3b-c91346510df8.xml",
      "dataset/9b7d1acf-b22f-4a1f-b6e8-f1ddd744dc07.xml",
      "dataset/a8e22479-28d2-4a8a-ae1c-2d40d80c1f9a.xml",
      "dataset/aab0cf80-0c64-11dd-84d1-b8a03c50a862.xml",
      "dataset/b0515413-6d32-490a-83a0-f8c08f002c70.xml",
      "dataset/b2d55172-8980-4195-9632-a186edb27d5a.xml",
      "dataset/b42c906d-28ef-4456-8fd6-d13d34bd50a7.xml",
      "dataset/b5cdf794-8fa4-4a85-8b26-755d087bf531.xml",
      "dataset/b740eaa0-0679-41dc-acb7-990d562dfa37.xml",
      "dataset/b89d52a2-861d-4388-adad-c0da3d55fc78.xml",
      "dataset/b929f23d-290f-4e85-8f17-764c55b3b284.xml",
      "dataset/c267909d-184f-4138-9e67-a074d478d52b.xml",
      "dataset/c8d12f8a-7e39-4e2c-92d7-825d590ad15b.xml",
      "dataset/cafff6a5-1fa4-4a90-a2b3-f3db78b93d02.xml",
      "dataset/cca05dd0-9f88-4d0a-b90a-d3f8f3a3f367.xml",
      "dataset/cd6e21c8-9e8a-493a-8a76-fbf7862069e5.xml",
      "dataset/cfb43618-1423-4031-b3ff-fbd2c264f48b.xml",
      "dataset/d415c253-4d61-4459-9d25-4015b9084fb0.xml",
      "dataset/d6655666-83fc-4959-bc93-56d920238d90.xml",
      "dataset/d8cd16ba-bb74-4420-821e-083f2bac17c2.xml",
      "dataset/defb9a47-c1a7-4fb2-9a0b-2da7c5260cad.xml",
      "dataset/e1a01804-881b-42ae-8f97-1e80f697fd56.xml",
      "dataset/e42c4be9-dc6d-466b-8df2-60ac8c47fadd.xml",
      "dataset/e523cf2d-4fc2-48d8-aa75-80ecbc90b3f5.xml",
      "dataset/ec6ecdeb-d8b3-4f28-8057-dad68feb616b.xml",
      "dataset/eccf4b09-f0c8-462d-a48c-41a7ce36815a.xml",
      "dataset/ed3d96f2-db7b-48cd-9960-f871e7df7286.xml",
      "dataset/f3f03cbf-1a01-4739-ae15-c1355b8c2dbf.xml",
      "dataset/f56df26e-73f5-4d37-bfed-3d46c0834e82.xml",
      "dataset/f873ef66-231a-4ea3-bd4d-a16f182bf337.xml",
      "dataset/f934f8e2-32ca-46a7-b2f8-b032a4740454.xml",
      "dataset/fcab85b5-5341-41b3-aa59-24432ea805b2.xml",
      "meta.xml",
      "metadata.xml",
      "multimedia.txt",
      "occurrence.txt",
      "rights.txt",
      "verbatim.txt"
    ],
    "metaSha256": "c6a9a2d4a93b631aeb1d5fe51f9ae9d7cc2159947fe98120443d5c6eb0760159",
    "occurrenceHeaderSha256": "0a41cd70263cfdd9153dd87edf503325cee241cd756b621a088409e969c4785a",
    "verbatimHeaderSha256": "8d1bacaf3ad44bede2c3854bc970ad38bb121e12f1a057a7585bb3b24e71be16",
    "occurrenceRows": 381,
    "verbatimRows": 381,
    "uniqueOccurrenceIds": 381
  },
  "nationalReconciliation": {
    "providerTotalRecords": 381,
    "occurrenceRows": 381,
    "verbatimRows": 381,
    "uniqueOccurrenceIds": 381,
    "selectedScopeRows": 109,
    "overlapRows": 0,
    "taxonomyRejectedRows": 0,
    "geographyRejectedRows": 272,
    "selectedEvidencePairs": 25,
    "selectedNoEvidencePairs": 25127,
    "selectedPairCount": 25152,
    "assertionEvents": 25,
    "reviewEvents": 25,
    "representativeRejections": 20,
    "duplicateRecords": 0
  },
  "stateReconciliation": {
    "stateCode": "HI",
    "runCreated": true,
    "runId": "20260819T205026Z__gbif-preserved-specimens__a10a87d47fef",
    "pairCount": 40,
    "pairSha256": "43b93e0e130cd54e9010b18aae31b7e4ac1d3376d246a9256aa94886b062a6a5",
    "candidateRecords": 0,
    "assertions": 0,
    "reviews": 0,
    "rejections": 0,
    "outcomes": 40
  }
}
